$ sudo lvs -o+lv_layout,stripes,devices /dev/mapper/vg_nvme-bar
  LV   VG      Attr       LSize  Pool Origin Data%  Meta%  Move Log Cpy%Sync Convert Layout     #Str Devices                                                                    
  bar  vg_nvme -wi-ao---- 10.00g                                                     striped       4 /dev/nvme1n1(9600),/dev/nvme2n1(9600),/dev/nvme0n1(9600),/dev/nvme3n1(9600)

$ sudo nvme id-ctrl /dev/nvme0n1
NVME Identify Controller:
vid     : 0x144d
ssvid   : 0x144d
sn      : S4EUNG0M240501V     
mn      : Samsung SSD 970 EVO Plus 250GB          
fr      : 1B2QEXM7
rab     : 2
ieee    : 002538
cmic    : 0
mdts    : 9
cntlid  : 4
ver     : 10300
rtd3r   : 30d40
rtd3e   : 7a1200
oaes    : 0
ctratt  : 0
oacs    : 0x17
acl     : 7
aerl    : 3
frmw    : 0x16
lpa     : 0x3
elpe    : 63
npss    : 4
avscc   : 0x1
apsta   : 0x1
wctemp  : 358
cctemp  : 358
mtfa    : 0
hmpre   : 0
hmmin   : 0
tnvmcap : 250059350016
unvmcap : 0
rpmbs   : 0
edstt   : 35
dsto    : 0
fwug    : 0
kas     : 0
hctma   : 0x1
mntmt   : 356
mxtmt   : 358
sanicap : 0
hmminds : 0
hmmaxd  : 0
sqes    : 0x66
cqes    : 0x44
maxcmd  : 0
nn      : 1
oncs    : 0x5f
fuses   : 0
fna     : 0x5
vwc     : 0x1
awun    : 1023
awupf   : 0
nvscc   : 1
acwu    : 0
sgls    : 0
subnqn  : 
ioccsz  : 0
iorcsz  : 0
icdoff  : 0
ctrattr : 0
msdbd   : 0
ps    0 : mp:7.80W operational enlat:0 exlat:0 rrt:0 rrl:0
          rwt:0 rwl:0 idle_power:- active_power:-
ps    1 : mp:6.00W operational enlat:0 exlat:0 rrt:1 rrl:1
          rwt:1 rwl:1 idle_power:- active_power:-
ps    2 : mp:3.40W operational enlat:0 exlat:0 rrt:2 rrl:2
          rwt:2 rwl:2 idle_power:- active_power:-
ps    3 : mp:0.0700W non-operational enlat:210 exlat:1200 rrt:3 rrl:3
          rwt:3 rwl:3 idle_power:- active_power:-
ps    4 : mp:0.0100W non-operational enlat:2000 exlat:8000 rrt:4 rrl:4
          rwt:4 rwl:4 idle_power:- active_power:-
